paper_id,record_source,source_database,source_record_id,file_name,title,authors,year,publication_type,venue_source,doi,url,official_url,abstract_summary,abstract,keywords,keywords_used,method_model,dataset_used,evaluation_metrics,key_contribution,limitation,relevance_score,decision,reason_for_decision,exclusion_reason_id,access_type,download_status,zotero_status,local_pdf_path,zotero_key,bibtex_key,duplicate_group_id,screening_status,notes,last_updated,utility_level,download_priority,useful_for,phase4_verification_reason,year_eligibility,previous_decision_before_year_rule,manual_access_status,preprocessing_method,feature_extraction_method,chapter_2_use,phase6_pdf_audit_status,chapter_2_role,chapter_2_priority,chapter_2_section,chapter_2_final_recommendation,chapter_2_overlap_notes
P069,phase3_metadata_search,Semantic Scholar; arXiv,SemanticScholar:985bd78dacbe5ed80f7015088a07f053e2a8ad5d; arXiv:2601.13593v1,Jose et al. - 2026 - Instant Preliminary Cardiac Analysis from Smartphone Auscultation A Real-World Canine Heart Sound D.pdf,Instant Preliminary Cardiac Analysis from Smartphone Auscultation: A Real-World Canine Heart Sound Dataset and Evaluation,Aswin Jose; Roeland P-J E. Decorte; Laurent Locquet,2026,Scholarly article,arXiv,,https://arxiv.org/abs/2601.13593,https://arxiv.org/abs/2601.13593,Presents a canine heart sound dataset and evaluates the SoNUS 3.2.x smartphone auscultation algorithm for veterinary heart-rate estimation.,Presents a canine heart sound dataset and evaluates the SoNUS 3.2.x smartphone auscultation algorithm for veterinary heart-rate estimation.,Q16,Q16,Multi-stage fallback machine learning pipeline with quality-aware filtering for canine heart-rate estimation.,"More than 100 canine smartphone recordings across veterinary centers, with 38 cardiologist-annotated recordings for evaluation.","Mean/median heart-rate accuracy, quality-score filtering, and percentile accuracy.",Shows smartphone auscultation robustness but in veterinary cardiac analysis.,Non-human canine dataset and diagnosis/monitoring focus; no heart-lung separation.,1,Exclude,Non-human veterinary cardiac monitoring paper; outside the FYP cardiopulmonary separation scope.,E10,Open Access,Downloaded and audited - excluded,PDF downloaded / audited - excluded,papers\pdfs\Jose et al. - 2026 - Instant Preliminary Cardiac Analysis from Smartphone Auscultation A Real-World Canine Heart Sound D.pdf,,jose2026instant,,full_text_audited,Phase 4: Priority 3; Weak; dataset; background. Year eligibility: within 2022-2026 review range. Phase 6 full-text PDF audit 2026-05-11: Exclude (1/5); PDF matched as Jose et al. - 2026 - Instant Preliminary Cardiac Analysis from Smartphone Auscultation A Real-World Canine Heart Sound D.pdf. Phase 6 metadata correction 2026-05-12: PDF text confirms arXiv:2601.13593v1; no DOI shown.,2026-05-12,Weak,3,not used,Canine smartphone heart-sound dataset is non-human and diagnosis/evaluation focused; not useful for this FYP scope.,Eligible: 2022-2026,,PDF downloaded manually by user; Phase 6 full-text audit complete,Quality scoring and fallback processing for variable smartphone auscultation recordings.,Heart-rate estimation and quality scoring features; exact features not central to FYP.,not used,Newly downloaded PDF audited in Phase 6,,,,,
P070,phase3_metadata_search,Semantic Scholar,SemanticScholar:0a0a2f26cbc0c713a0488d8fe609830792d2207d,Pal et al. - 2026 - Phonocardiogram Signal Processing with Heart Sound Classification Using Transfer Learning.pdf,Phonocardiogram Signal Processing with Heart Sound Classification Using Transfer Learning,Manas Pal; Ravi Ranjan; Vikalp Kumar; Veer Dwij Ogrkumar,2026,Conference,2026 International Conference on Artificial Intelligence and Technology Management in Smart Infrastructure (IATMSI),10.1109/IATMSI68868.2026.11466265,https://www.semanticscholar.org/paper/0a0a2f26cbc0c713a0488d8fe609830792d2207d,https://doi.org/10.1109/iatmsi68868.2026.11466265,"Uses wavelet denoising, Mel spectrograms, and pretrained CNN transfer learning for heart sound classification.","Uses wavelet denoising, Mel spectrograms, and pretrained CNN transfer learning for heart sound classification.",Q13,Q13,"Transfer learning with VGG16, VGG19, ResNet50, InceptionV3, EfficientNetB0, and MobileNetV2.",PhysioNet/CinC 2016 dataset with 3240 PCG recordings resampled to 2000 Hz.,"Accuracy, precision, recall, F1-score, specificity, sensitivity, AUROC.",Useful preprocessing/feature-extraction reference for PCG classification pipelines.,Classification-only; no cardiopulmonary separation task.,2,Maybe,Keep only for preprocessing and feature-extraction background; not a core separation paper.,,University Access Needed,Downloaded and audited,PDF downloaded / audited,papers\pdfs\Pal et al. - 2026 - Phonocardiogram Signal Processing with Heart Sound Classification Using Transfer Learning.pdf,,pal2026phonocardiogram,,full_text_audited,Phase 4: Priority 3; Indirectly useful; preprocessing; feature extraction; dataset. Year eligibility: within 2022-2026 review range. Phase 6 full-text PDF audit 2026-05-11: Maybe (2/5); PDF matched as Pal et al. - 2026 - Phonocardiogram Signal Processing with Heart Sound Classification Using Transfer Learning.pdf. Final Chapter 2 selection 2026-05-16: Background-only paper; priority Low; section deep learning / ML methods; Backup.,2026-05-11,Indirectly useful,3,preprocessing; feature extraction; dataset,"PCG classification paper may inform Mel-spectrogram/transfer-learning preprocessing, but it is diagnosis/classification only.",Eligible: 2022-2026,,PDF downloaded manually by user; Phase 6 full-text audit complete,"Wavelet denoising, resampling to 2000 Hz, and Mel-spectrogram generation.",Mel spectrogram time-frequency representations and pretrained CNN embeddings.,preprocessing; feature extraction,Newly downloaded PDF audited in Phase 6,Background-only paper,Low,deep learning / ML methods,Backup,Transfer-learning PCG classification only; use only if extra feature-extraction background is needed.
P071,phase7_metadata_search,Crossref; OpenAlex,10.5005/jp-journals-11002-0068,,Digital Stethoscope Use in Neonates: A Systematic Review,Meagan Roff; Olivia Slifirski; Ethan Grooby; Faezeh Marzbanrad; Atul Malhotra,2023,journal-article,Newborn,10.5005/jp-journals-11002-0068,https://doi.org/10.5005/jp-journals-11002-0068,https://doi.org/10.5005/jp-journals-11002-0068,"Aim: To assess the evidence for the use of digital stethoscopes in neonates and evaluate whether they are effective, appropriate, and advantageous for neonatal auscultation.Methods: A systematic review and narrative synthesis of studies published between January 1, 1990 and May 29, 2023 was conducted following searches of MEDLINE, Embase, PubMed, Scopus, and Google Scholar databases, as well as trial...","Aim: To assess the evidence for the use of digital stethoscopes in neonates and evaluate whether they are effective, appropriate, and advantageous for neonatal auscultation.Methods: A systematic review and narrative synthesis of studies published between January 1, 1990 and May 29, 2023 was conducted following searches of MEDLINE, Embase, PubMed, Scopus, and Google Scholar databases, as well as trial registries.Results: Of 3,852 records identified, a total of 41 papers were eligible and included in the narrative synthesis.Thirteen records were non-full-text articles, either in the form of journal letters or conference abstracts, and these were included separately for completion purposes but may be unreliable.Twenty eight papers were full-text articles and were included in a full qualitative analysis.Digital stethoscopes have been studied in neonatology across various clinical areas, including artificial intelligence for sound quality assessment and chest sound separation (n = 5), cardiovascular sounds (n = 11), respiratory sounds (n = 4), bowel sounds (n = 4), swallowing sounds (n = 2), and telemedicine (n = 2).This paper discusses the potential utility of digital stethoscope technology for the interpretation of neonatal sounds for both humans and artificial intelligence.The limitations of current devices are also assessed. Conclusions:The utilization of digital stethoscopes in neonatology is an emerging field with a wide range of potential applications, which has the capacity to advance neonatal auscultation.Artificial intelligence and digital stethoscope technology offer novel objective avenues for automatic pathological sound detection.Further, digital stethoscopes may improve our scientific understanding of normal neonatal physiology and can be employed in telemedicine to facilitate remote medical access.Digital stethoscopes can also provide phonocardiograms, enabling enhanced interpretation of neonatal cardiac sounds.However, current digital stethoscopes necessitate refinement as they consistently produce low-quality sounds when used on neonates.",,"""chest sound separation"" ""deep learning""; respiratory cardiac sound separation",Systematic review of neonatal digital stethoscope use.,Neonatal digital stethoscope literature; no separation dataset identified from metadata.,Review-level outcomes; not a source-separation metric paper.,Supports background on neonatal digital stethoscope workflows and adoption constraints.,Not a cardiopulmonary source-separation study.,3,Maybe,Recent systematic review on digital stethoscope use in neonates; useful for clinical/software context but not a separation method.,,Metadata Only,Not downloaded,Pending,,,roff2023digital,,metadata_screened,"Phase 7 metadata-only candidate added 2026-05-12. No PDF downloaded, no login attempted. Search sources: Crossref; OpenAlex. Decision based on title/abstract metadata only. Final Chapter 2 selection 2026-05-16: Background-only paper; priority Low; section software/prototype relevance; Backup.",2026-05-12,Background support,2,background; software/prototype; research gap,,Eligible: 2022-2026,,,,,background; software/prototype; research gap,,Background-only paper,Low,software/prototype relevance,Backup,Neonatal digital stethoscope systematic review; useful only for short context.
P072,phase7_metadata_search,Crossref; OpenAlex,10.1186/s40779-023-00479-3,,Deep learning-based lung sound analysis for intelligent stethoscope,Dong-Min Huang; Jia Huang; Kun Qiao; Nan-Shan Zhong; Hong-Zhou Lu; Wen-Jin Wang,2023,journal-article,Military Medical Research,10.1186/s40779-023-00479-3,https://doi.org/10.1186/s40779-023-00479-3,https://doi.org/10.1186/s40779-023-00479-3,"Abstract Auscultation is crucial for the diagnosis of respiratory system diseases. However, traditional stethoscopes have inherent limitations, such as inter-listener variability and subjectivity, and they cannot record respiratory sounds for offline/retrospective diagnosis or remote prescriptions in telemedicine. The emergence of digital stethoscopes has overcome these limitations by allowing physicians to store...","Abstract Auscultation is crucial for the diagnosis of respiratory system diseases. However, traditional stethoscopes have inherent limitations, such as inter-listener variability and subjectivity, and they cannot record respiratory sounds for offline/retrospective diagnosis or remote prescriptions in telemedicine. The emergence of digital stethoscopes has overcome these limitations by allowing physicians to store and share respiratory sounds for consultation and education. On this basis, machine learning, particularly deep learning, enables the fully-automatic analysis of lung sounds that may pave the way for intelligent stethoscopes. This review thus aims to provide a comprehensive overview of deep learning algorithms used for lung sound analysis to emphasize the significance of artificial intelligence (AI) in this field. We focus on each component of deep learning-based lung sound analysis systems, including the task categories, public datasets, denoising methods, and, most importantly, existing deep learning methods, i.e., the state-of-the-art approaches to convert lung sounds into two-dimensional (2D) spectrograms and use convolutional neural networks for the end-to-end recognition of respiratory diseases or abnormal lung sounds. Additionally, this review highlights current challenges in this field, including the variety of devices, noise sensitivity, and poor interpretability of deep models. To address the poor reproducibility and variety of deep learning in this field, this review also provides a scalable and flexible open-source framework that aims to standardize the algorithmic workflow and provide a solid basis for replication and future extension: https://github.com/contactless-healthcare/Deep-Learning-for-Lung-Sound-Analysis .",,"""chest sound separation"" ""deep learning""; ""stethoscope sound separation"" ""machine learning""",Deep learning-based lung sound analysis for intelligent stethoscope applications.,Lung sound data discussed in paper metadata.,Classification/analysis metrics rather than separation metrics.,Provides recent lung-sound ML context for digital stethoscope systems.,Lung-sound analysis focus; no heart/lung source separation output.,3,Maybe,Relevant lung sound deep learning/intelligent stethoscope background; useful for preprocessing and model context but not heart-lung separation.,,Metadata Only,Not downloaded,Pending,,,huang2023deep,,metadata_screened,"Phase 7 metadata-only candidate added 2026-05-12. No PDF downloaded, no login attempted. Search sources: Crossref; OpenAlex. Decision based on title/abstract metadata only. Final Chapter 2 selection 2026-05-16: Background-only paper; priority Low; section deep learning / ML methods; Backup.",2026-05-12,Background support,2,background; preprocessing; model; research gap,,Eligible: 2022-2026,,,Deep learning-based lung sound analysis for intelligent stethoscope applications.,,background; preprocessing; model; research gap,,Background-only paper,Low,deep learning / ML methods,Backup,Intelligent stethoscope lung analysis; no separation output.
P073,phase7_metadata_search,Crossref; OpenAlex,10.1109/icsps66615.2025.11347745,,Cardiorespiratory Sound Separation Using Singular Spectrum Analysis,Bowen Han; Wei Quan,2025,proceedings-article,2025 17th International Conference on Signal Processing Systems (ICSPS),10.1109/icsps66615.2025.11347745,https://doi.org/10.1109/icsps66615.2025.11347745,https://doi.org/10.1109/icsps66615.2025.11347745,"Cardiorespiratory signal separation is a critical task in biomedical signal processing, with significant implications for improving the accuracy of cardiovascular and pulmonary disease diagnoses. The presence of complex mixed signals and noise complicates the separation of cardiac and respiratory sounds from a single-channel recording. Traditional separation methods struggle due to the overlapping frequency ranges...","Cardiorespiratory signal separation is a critical task in biomedical signal processing, with significant implications for improving the accuracy of cardiovascular and pulmonary disease diagnoses. The presence of complex mixed signals and noise complicates the separation of cardiac and respiratory sounds from a single-channel recording. Traditional separation methods struggle due to the overlapping frequency ranges of these physiological signals. In this work, we propose a multi-stage Singular Spectrum Analysis (MSSA)-based framework for the separation of cardiac and respiratory sounds. The approach utilizes a two-stage SSA process where the first stage isolates the cardiac components through periodic structure analysis, while the second stage extracts respiratory components based on relative variance and cross-correlation. Key features of this method include a systematic selection of RCs that ensure high-quality signal separation, preserving physiological integrity. The framework was validated on real-world cardiorespiratory recordings obtained via electronic digital stethoscopes, demonstrating robustness across varying recording conditions.",,cardiorespiratory sound separation,Multi-stage Singular Spectrum Analysis framework for cardiac and respiratory sound separation.,Real-world cardiorespiratory recordings from electronic digital stethoscopes according to metadata.,Metadata indicates validation on real-world recordings; exact metrics require full-text audit.,Adds a recent non-deep-learning direct separation method for comparison against NMF/VMD/deep models.,Full text not locally audited yet; metadata-only screening.,5,Include,Direct cardiorespiratory sound separation paper using singular spectrum analysis on electronic stethoscope recordings.,,Metadata Only,Not downloaded,Pending,,,han2025cardiorespiratory,,metadata_screened,"Phase 7 metadata-only candidate added 2026-05-12. No PDF downloaded, no login attempted. Search sources: Crossref; OpenAlex. Decision based on title/abstract metadata only. Final Chapter 2 selection 2026-05-16: Core Chapter 2 paper; priority High; section cardiopulmonary sound separation; Recommended for Chapter 2.",2026-05-12,Directly useful,1,related work; preprocessing; model; evaluation; research gap,,Eligible: 2022-2026,,,Multi-stage Singular Spectrum Analysis framework for cardiac and respiratory sound separation.,,related work; preprocessing; model; evaluation; research gap,,Core Chapter 2 paper,High,cardiopulmonary sound separation,Recommended for Chapter 2,"Newest direct cardiorespiratory separation candidate; metadata-only, so cite after manual access if possible."
P074,phase7_metadata_search,Crossref; OpenAlex,10.3390/s23125750,,StethAid: A Digital Auscultation Platform for Pediatrics,Youness Arjoune; Trong N. Nguyen; Tyler Salvador; Anha Telluri; Jonathan C. Schroeder; Robert L. Geggel; Joseph W. May; Dinesh K. Pillai; Stephen J. Teach; Shilpa J. Patel; Robin W. Doroshow; Raj Shekhar,2023,journal-article,Sensors,10.3390/s23125750,https://doi.org/10.3390/s23125750,https://doi.org/10.3390/s23125750,(1) Background: Mastery of auscultation can be challenging for many healthcare providers. Artificial intelligence (AI)-powered digital support is emerging as an aid to assist with the interpretation of auscultated sounds. A few AI-augmented digital stethoscopes exist but none are dedicated to pediatrics. Our goal was to develop a digital auscultation platform for pediatric medicine. (2) Methods: We developed...,"(1) Background: Mastery of auscultation can be challenging for many healthcare providers. Artificial intelligence (AI)-powered digital support is emerging as an aid to assist with the interpretation of auscultated sounds. A few AI-augmented digital stethoscopes exist but none are dedicated to pediatrics. Our goal was to develop a digital auscultation platform for pediatric medicine. (2) Methods: We developed StethAid—a digital platform for artificial intelligence-assisted auscultation and telehealth in pediatrics—that consists of a wireless digital stethoscope, mobile applications, customized patient-provider portals, and deep learning algorithms. To validate the StethAid platform, we characterized our stethoscope and used the platform in two clinical applications: (1) Still’s murmur identification and (2) wheeze detection. The platform has been deployed in four children’s medical centers to build the first and largest pediatric cardiopulmonary datasets, to our knowledge. We have trained and tested deep-learning models using these datasets. (3) Results: The frequency response of the StethAid stethoscope was comparable to those of the commercially available Eko Core, Thinklabs One, and Littman 3200 stethoscopes. The labels provided by our expert physician offline were in concordance with the labels of providers at the bedside using their acoustic stethoscopes for 79.3% of lungs cases and 98.3% of heart cases. Our deep learning algorithms achieved high sensitivity and specificity for both Still’s murmur identification (sensitivity of 91.9% and specificity of 92.6%) and wheeze detection (sensitivity of 83.7% and specificity of 84.4%). (4) Conclusions: Our team has created a technically and clinically validated pediatric digital AI-enabled auscultation platform. Use of our platform could improve efficacy and efficiency of clinical care for pediatric patients, reduce parental anxiety, and result in cost savings.",,cardiopulmonary sound dataset,Digital auscultation platform and pediatric workflow support.,Pediatric auscultation platform data; public dataset status requires full-text check.,Platform evaluation metrics; not separation metrics.,Supports FYP discussion of usable biomedical audio collection/prototype workflows.,Platform paper rather than separation algorithm.,3,Maybe,Digital auscultation platform for pediatrics; useful for software/prototype and data acquisition context.,,Metadata Only,Not downloaded,Pending,,,arjoune2023stethaid,,metadata_screened,"Phase 7 metadata-only candidate added 2026-05-12. No PDF downloaded, no login attempted. Search sources: Crossref; OpenAlex. Decision based on title/abstract metadata only. Final Chapter 2 selection 2026-05-16: Supporting paper; priority Medium; section software/prototype relevance; Recommended for Chapter 2.",2026-05-12,System/prototype support,2,background; software/prototype; dataset; research gap,,Eligible: 2022-2026,,,,,background; dataset; software/prototype; research gap,,Supporting paper,Medium,software/prototype relevance,Recommended for Chapter 2,Digital auscultation platform context for pediatric workflow and application design.
P075,phase7_metadata_search,Crossref,10.36001/phmap.2023.v4i1.3604,,Sound-Dr: Reliable Sound Dataset and Baseline Artificial Intelligence System for Respiratory Illnesses,Van Truong Hoang; Quang Nguyen; Quoc Cuong Nguyen; Xuan Phong Nguyen; Hoang Nguyen,2023,journal-article,PHM Society Asia-Pacific Conference,10.36001/phmap.2023.v4i1.3604,https://doi.org/10.36001/phmap.2023.v4i1.3604,https://doi.org/10.36001/phmap.2023.v4i1.3604,"As the burden of respiratory diseases continues to fall on society worldwide, this paper proposes a high-quality and reliable dataset of human sounds for studying respiratory illnesses, including pneumonia and COVID-19. It consists of coughing, mouth breathing, and nose breathing sounds together with metadata on related clinical characteristics. We also develop a proof-of-concept system for establishing baselines...","As the burden of respiratory diseases continues to fall on society worldwide, this paper proposes a high-quality and reliable dataset of human sounds for studying respiratory illnesses, including pneumonia and COVID-19. It consists of coughing, mouth breathing, and nose breathing sounds together with metadata on related clinical characteristics. We also develop a proof-of-concept system for establishing baselines and benchmarking against multiple datasets, such as Coswara and COUGHVID. Our comprehensive experimentsshow that the Sound-Dr dataset has richer features, better performance, and is more robust to dataset shifts in various machine learning tasks. It is promising for a wide range of real-time applications on mobile devices. The proposed dataset and system will serve as practical tools to support healthcare professionals in diagnosing respiratory disorders. The dataset and code are publicly available here: https://github.com/ReML-AI/Sound-Dr/.",,cardiopulmonary sound dataset,Respiratory sound dataset with baseline AI system.,Sound-Dr respiratory illness sound dataset.,Baseline AI system metrics; exact details require full-text audit.,Adds a respiratory audio dataset reference for Chapter 2 dataset limitations and evaluation context.,Respiratory illness focus; not heart-lung source separation.,3,Maybe,Respiratory illness sound dataset and baseline AI system; useful as dataset/evaluation background.,,Metadata Only,Not downloaded,Pending,,,hoang2023reliable,,metadata_screened,"Phase 7 metadata-only candidate added 2026-05-12. No PDF downloaded, no login attempted. Search sources: Crossref. Decision based on title/abstract metadata only. Final Chapter 2 selection 2026-05-16: Dataset/evaluation paper; priority Medium; section datasets; Recommended for Chapter 2.",2026-05-12,Dataset support,2,dataset; evaluation; background; research gap,,Eligible: 2022-2026,,,,,dataset; evaluation; background; research gap,,Dataset/evaluation paper,Medium,datasets,Recommended for Chapter 2,Respiratory dataset/background evidence; not paired heart-lung separation.
